{
  "version": 2,
  "title": "Untitled",
  "canvas": {
    "mode": "mobile",
    "width": 390,
    "height": 844
  },
  "layers": [
    {
      "id": "layer_47653aa7",
      "name": "Confirmation",
      "visible": false,
      "locked": true
    },
    {
      "id": "layer_6f7c2b06",
      "name": "Default",
      "visible": true,
      "locked": false
    }
  ],
  "elements": [
    {
      "id": "container_cfb7de76",
      "type": "container",
      "name": "container1",
      "label": "",
      "note": "",
      "x": 16,
      "y": 16,
      "width": 352,
      "height": 440,
      "layerId": "layer_6f7c2b06",
      "visible": true,
      "locked": false,
      "zIndex": 0
    },
    {
      "id": "text_db7456da",
      "type": "text",
      "name": "text3",
      "label": "Metrics",
      "note": "",
      "x": 40,
      "y": 24,
      "width": 320,
      "height": 40,
      "layerId": "layer_6f7c2b06",
      "visible": true,
      "locked": false,
      "zIndex": 1,
      "textStyle": {
        "fontSize": 27,
        "bold": true
      }
    },
    {
      "id": "dialog_b7eba97b",
      "type": "dialog",
      "name": "dialog1",
      "label": "Are you sure?",
      "note": "",
      "x": 72,
      "y": 192,
      "width": 248,
      "height": 144,
      "layerId": "layer_47653aa7",
      "visible": true,
      "locked": false,
      "zIndex": 0
    },
    {
      "id": "button_241e04cd",
      "type": "button",
      "name": "button1Copy",
      "label": "No",
      "note": "Closes this dialog",
      "x": 88,
      "y": 296,
      "width": 104,
      "height": 32,
      "layerId": "layer_47653aa7",
      "visible": true,
      "locked": false,
      "zIndex": 1
    },
    {
      "id": "text_5273d001",
      "type": "text",
      "name": "text1",
      "label": "Record will be deleted",
      "note": "",
      "x": 88,
      "y": 240,
      "width": 220,
      "height": 48,
      "layerId": "layer_47653aa7",
      "visible": true,
      "locked": false,
      "zIndex": 2
    },
    {
      "id": "button_148322c1",
      "type": "button",
      "name": "button1",
      "label": "Yes",
      "note": "Deletes the entry from the table",
      "x": 208,
      "y": 296,
      "width": 104,
      "height": 32,
      "layerId": "layer_47653aa7",
      "visible": true,
      "locked": false,
      "zIndex": 3
    },
    {
      "id": "text_09b1bea8",
      "type": "text",
      "name": "text4",
      "label": "Active",
      "note": "Block containing all non-archived metrics",
      "x": 40,
      "y": 72,
      "width": 220,
      "height": 24,
      "layerId": "layer_6f7c2b06",
      "visible": true,
      "locked": false,
      "zIndex": 2
    },
    {
      "id": "list_508feb49",
      "type": "list",
      "name": "list1",
      "label": "",
      "note": "",
      "x": 40,
      "y": 112,
      "width": 312,
      "height": 168,
      "layerId": "layer_6f7c2b06",
      "visible": true,
      "locked": false,
      "zIndex": 3,
      "items": [
        "Vitamins",
        "Weight",
        "Cups of coffee",
        "Blood pressure",
        "..."
      ]
    },
    {
      "id": "icon_5c27c579",
      "type": "icon",
      "name": "icon1",
      "label": "▶️",
      "note": "",
      "x": 312,
      "y": 112,
      "width": 32,
      "height": 32,
      "layerId": "layer_6f7c2b06",
      "visible": true,
      "locked": false,
      "zIndex": 4,
      "contentSize": 14
    },
    {
      "id": "icon_cc94b97e",
      "type": "icon",
      "name": "icon1Copy",
      "label": "▶️",
      "note": "",
      "x": 312,
      "y": 144,
      "width": 32,
      "height": 32,
      "layerId": "layer_6f7c2b06",
      "visible": true,
      "locked": false,
      "zIndex": 5,
      "contentSize": 14
    },
    {
      "id": "icon_3173e21f",
      "type": "icon",
      "name": "icon1Copy2",
      "label": "▶️",
      "note": "",
      "x": 312,
      "y": 176,
      "width": 32,
      "height": 32,
      "layerId": "layer_6f7c2b06",
      "visible": true,
      "locked": false,
      "zIndex": 6,
      "contentSize": 14
    },
    {
      "id": "icon_4f690bb2",
      "type": "icon",
      "name": "icon1Copy3",
      "label": "▶️",
      "note": "",
      "x": 312,
      "y": 208,
      "width": 32,
      "height": 32,
      "layerId": "layer_6f7c2b06",
      "visible": true,
      "locked": false,
      "zIndex": 7,
      "contentSize": 14
    },
    {
      "id": "icon_2f4862e3",
      "type": "icon",
      "name": "icon1Copy4",
      "label": "▶️",
      "note": "",
      "x": 312,
      "y": 248,
      "width": 32,
      "height": 32,
      "layerId": "layer_6f7c2b06",
      "visible": true,
      "locked": false,
      "zIndex": 8,
      "contentSize": 14
    },
    {
      "id": "tabs_4979deb3",
      "type": "tabs",
      "name": "tabs1",
      "label": "",
      "note": "",
      "x": 16,
      "y": 416,
      "width": 352,
      "height": 40,
      "layerId": "layer_6f7c2b06",
      "visible": true,
      "locked": false,
      "zIndex": 9,
      "items": [
        "Metrics",
        "New entry",
        "Settings"
      ]
    }
  ]
}